{
  "id": "druid", "name": "Druid", "role": "control", "hitDie": 8, "saves": ["int", "wis"],
  "armorProf": ["light", "medium", "shield"], "weaponProf": ["simple", "scimitar"],
  "skillChoices": { "count": 2, "from": ["nature", "survival", "perception", "animal_handling", "arcana", "insight",
                                         "medicine", "religion"] },
  "startingKit": { "weapon": "quarterstaff", "armor": "leather", "shield": true,
                   "bag": [ { "item": "potion_of_healing", "count": 1 } ] },
  "resources": { "wild": { "1": 2, "6": 3 },
                 "mana": { "1": 3, "2": 4, "3": 6, "4": 7, "5": 8, "6": 9, "7": 10, "8": 10, "9": 11, "10": 12 } },
  "primaryResource": "mana",
  "features": {
    "1": [ { "choose": 2, "from": ["druid.thorn_whip", "druid.produce_flame", "druid.shillelagh"] },
           { "choose": 3, "from": ["druid.entangle", "druid.faerie_fire", "druid.thunderwave", "druid.cure_wounds",
                                   "druid.healing_word", "druid.fog_cloud"] } ],
    "2": [ { "ability": "druid.wild_shape_wolf" },
           { "choose": 1, "from": ["druid.entangle", "druid.faerie_fire", "druid.thunderwave", "druid.cure_wounds",
                                   "druid.healing_word", "druid.fog_cloud"] } ],
    "3": [ { "choose": 2, "from": ["druid.entangle", "druid.faerie_fire", "druid.thunderwave", "druid.cure_wounds",
                                   "druid.healing_word", "druid.fog_cloud", "druid.hold_person", "druid.spike_growth",
                                   "druid.barkskin", "druid.moonbeam", "druid.lesser_restoration"] } ],
    "4": [ { "ability": "druid.wild_shape_bear" },
           { "choose": 1, "from": ["druid.entangle", "druid.faerie_fire", "druid.thunderwave", "druid.cure_wounds",
                                   "druid.healing_word", "druid.fog_cloud", "druid.hold_person", "druid.spike_growth",
                                   "druid.barkskin", "druid.moonbeam", "druid.lesser_restoration"] } ],
    "5": [ { "choose": 2, "from": ["druid.entangle", "druid.faerie_fire", "druid.thunderwave", "druid.cure_wounds",
                                   "druid.healing_word", "druid.fog_cloud", "druid.hold_person", "druid.spike_growth",
                                   "druid.barkskin", "druid.moonbeam", "druid.lesser_restoration", "druid.call_lightning",
                                   "druid.sleet_storm", "druid.dispel_magic", "druid.conjure_animals"] } ],
    "6": [ { "ability": "druid.wild_shape_dire_wolf" },
           { "choose": 1, "from": ["druid.entangle", "druid.faerie_fire", "druid.thunderwave", "druid.cure_wounds",
                                   "druid.healing_word", "druid.fog_cloud", "druid.hold_person", "druid.spike_growth",
                                   "druid.barkskin", "druid.moonbeam", "druid.lesser_restoration", "druid.call_lightning",
                                   "druid.sleet_storm", "druid.dispel_magic", "druid.conjure_animals"] } ],
    "7": [ { "choose": 1, "from": ["druid.entangle", "druid.faerie_fire", "druid.thunderwave", "druid.cure_wounds",
                                   "druid.healing_word", "druid.fog_cloud", "druid.hold_person", "druid.spike_growth",
                                   "druid.barkskin", "druid.moonbeam", "druid.lesser_restoration", "druid.call_lightning",
                                   "druid.sleet_storm", "druid.dispel_magic", "druid.conjure_animals", "druid.ice_storm",
                                   "druid.blight"] } ],
    "8": [ { "choose": 1, "from": ["druid.entangle", "druid.faerie_fire", "druid.thunderwave", "druid.cure_wounds",
                                   "druid.healing_word", "druid.fog_cloud", "druid.hold_person", "druid.spike_growth",
                                   "druid.barkskin", "druid.moonbeam", "druid.lesser_restoration", "druid.call_lightning",
                                   "druid.sleet_storm", "druid.dispel_magic", "druid.conjure_animals", "druid.ice_storm",
                                   "druid.blight"] } ],
    "9": [ { "choose": 1, "from": ["druid.entangle", "druid.faerie_fire", "druid.thunderwave", "druid.cure_wounds",
                                   "druid.healing_word", "druid.fog_cloud", "druid.hold_person", "druid.spike_growth",
                                   "druid.barkskin", "druid.moonbeam", "druid.lesser_restoration", "druid.call_lightning",
                                   "druid.sleet_storm", "druid.dispel_magic", "druid.conjure_animals", "druid.ice_storm",
                                   "druid.blight", "druid.mass_cure_wounds", "druid.greater_restoration"] } ],
    "10": [ { "choose": 1, "from": ["druid.entangle", "druid.faerie_fire", "druid.thunderwave", "druid.cure_wounds",
                                    "druid.healing_word", "druid.fog_cloud", "druid.hold_person", "druid.spike_growth",
                                    "druid.barkskin", "druid.moonbeam", "druid.lesser_restoration", "druid.call_lightning",
                                    "druid.sleet_storm", "druid.dispel_magic", "druid.conjure_animals", "druid.ice_storm",
                                    "druid.blight", "druid.mass_cure_wounds", "druid.greater_restoration"] } ]
  },
  "subclasses": [],
  "subclassesPending": true,
  "defaultPicks": {
    "1": ["druid.thorn_whip", "druid.produce_flame", "druid.entangle", "druid.faerie_fire", "druid.thunderwave"],
    "2": ["druid.thorn_whip", "druid.produce_flame", "druid.entangle", "druid.faerie_fire", "druid.thunderwave",
          "druid.healing_word"],
    "3": ["druid.thorn_whip", "druid.produce_flame", "druid.entangle", "druid.faerie_fire", "druid.thunderwave",
          "druid.healing_word", "druid.hold_person", "druid.spike_growth"],
    "4": ["druid.thorn_whip", "druid.produce_flame", "druid.entangle", "druid.faerie_fire", "druid.thunderwave",
          "druid.healing_word", "druid.hold_person", "druid.spike_growth", "druid.moonbeam"],
    "5": ["druid.thorn_whip", "druid.produce_flame", "druid.entangle", "druid.faerie_fire", "druid.thunderwave",
          "druid.healing_word", "druid.hold_person", "druid.spike_growth", "druid.moonbeam", "druid.call_lightning",
          "druid.sleet_storm"],
    "6": ["druid.thorn_whip", "druid.produce_flame", "druid.entangle", "druid.faerie_fire", "druid.thunderwave",
          "druid.healing_word", "druid.hold_person", "druid.spike_growth", "druid.moonbeam", "druid.call_lightning",
          "druid.sleet_storm", "druid.conjure_animals"],
    "7": ["druid.thorn_whip", "druid.produce_flame", "druid.entangle", "druid.faerie_fire", "druid.thunderwave",
          "druid.healing_word", "druid.hold_person", "druid.spike_growth", "druid.moonbeam", "druid.call_lightning",
          "druid.sleet_storm", "druid.conjure_animals", "druid.ice_storm"],
    "8": ["druid.thorn_whip", "druid.produce_flame", "druid.entangle", "druid.faerie_fire", "druid.thunderwave",
          "druid.healing_word", "druid.hold_person", "druid.spike_growth", "druid.moonbeam", "druid.call_lightning",
          "druid.sleet_storm", "druid.conjure_animals", "druid.ice_storm", "druid.blight"],
    "9": ["druid.thorn_whip", "druid.produce_flame", "druid.entangle", "druid.faerie_fire", "druid.thunderwave",
          "druid.healing_word", "druid.hold_person", "druid.spike_growth", "druid.moonbeam", "druid.call_lightning",
          "druid.sleet_storm", "druid.conjure_animals", "druid.ice_storm", "druid.blight", "druid.mass_cure_wounds"],
    "10": ["druid.thorn_whip", "druid.produce_flame", "druid.entangle", "druid.faerie_fire", "druid.thunderwave",
           "druid.healing_word", "druid.hold_person", "druid.spike_growth", "druid.moonbeam", "druid.call_lightning",
           "druid.sleet_storm", "druid.conjure_animals", "druid.ice_storm", "druid.blight", "druid.mass_cure_wounds",
           "druid.greater_restoration"]
  },
  "aiTags": { "tags": ["control", "caster"], "priority": ["wis", "con", "dex", "int", "cha", "str"] },
  "castingStat": "wis"
}
