{
  "id": "warlock", "name": "Warlock", "role": "striker", "hitDie": 8, "saves": ["wis", "cha"],
  "armorProf": ["light"], "weaponProf": ["simple"],
  "skillChoices": { "count": 2, "from": ["arcana", "deception", "intimidation", "history", "investigation", "nature",
                                         "religion"] },
  "startingKit": { "weapon": "quarterstaff", "armor": "leather", "shield": false,
                   "bag": [ { "item": "potion_of_healing", "count": 1 } ] },
  "resources": { "pact": { "1": 2, "5": 3, "9": 4 } },
  "primaryResource": "pact",
  "features": {
    "1": [ { "passive": "warlock.pact_magic" },
           { "ability": "warlock.eldritch_blast" },
           { "ability": "warlock.hex" },
           { "passive": "warlock.hex_damage" },
           { "choose": 1, "from": ["warlock.chill_touch", "warlock.poison_spray"] },
           { "choose": 2, "from": ["warlock.arms_of_hadar", "warlock.armor_of_agathys", "warlock.hellish_rebuke",
                                   "warlock.witch_bolt"] } ],
    "2": [ { "choose": 2, "from": ["warlock.agonizing_blast", "warlock.repelling_blast", "warlock.fiendish_vigor",
                                   "warlock.devils_sight"] } ],
    "3": [ { "choose": 1, "from": ["warlock.arms_of_hadar", "warlock.armor_of_agathys", "warlock.hellish_rebuke",
                                   "warlock.witch_bolt", "warlock.shatter", "warlock.misty_step", "warlock.hold_person",
                                   "warlock.darkness"] } ],
    "4": [ { "choose": 1, "from": ["warlock.arms_of_hadar", "warlock.armor_of_agathys", "warlock.hellish_rebuke",
                                   "warlock.witch_bolt", "warlock.shatter", "warlock.misty_step", "warlock.hold_person",
                                   "warlock.darkness"] } ],
    "5": [ { "choose": 1, "from": ["warlock.agonizing_blast", "warlock.repelling_blast", "warlock.fiendish_vigor",
                                   "warlock.devils_sight", "warlock.maddening_hex", "warlock.one_with_shadows"] },
           { "choose": 1, "from": ["warlock.arms_of_hadar", "warlock.armor_of_agathys", "warlock.hellish_rebuke",
                                   "warlock.witch_bolt", "warlock.shatter", "warlock.misty_step", "warlock.hold_person",
                                   "warlock.darkness", "warlock.hunger_of_hadar", "warlock.counterspell",
                                   "warlock.vampiric_touch"] } ],
    "6": [ { "choose": 1, "from": ["warlock.arms_of_hadar", "warlock.armor_of_agathys", "warlock.hellish_rebuke",
                                   "warlock.witch_bolt", "warlock.shatter", "warlock.misty_step", "warlock.hold_person",
                                   "warlock.darkness", "warlock.hunger_of_hadar", "warlock.counterspell",
                                   "warlock.vampiric_touch"] } ],
    "7": [ { "choose": 1, "from": ["warlock.arms_of_hadar", "warlock.armor_of_agathys", "warlock.hellish_rebuke",
                                   "warlock.witch_bolt", "warlock.shatter", "warlock.misty_step", "warlock.hold_person",
                                   "warlock.darkness", "warlock.hunger_of_hadar", "warlock.counterspell",
                                   "warlock.vampiric_touch", "warlock.blight", "warlock.dimension_door",
                                   "warlock.shadow_of_moil"] } ],
    "8": [ { "choose": 1, "from": ["warlock.arms_of_hadar", "warlock.armor_of_agathys", "warlock.hellish_rebuke",
                                   "warlock.witch_bolt", "warlock.shatter", "warlock.misty_step", "warlock.hold_person",
                                   "warlock.darkness", "warlock.hunger_of_hadar", "warlock.counterspell",
                                   "warlock.vampiric_touch", "warlock.blight", "warlock.dimension_door",
                                   "warlock.shadow_of_moil"] } ],
    "9": [ { "choose": 1, "from": ["warlock.agonizing_blast", "warlock.repelling_blast", "warlock.fiendish_vigor",
                                   "warlock.devils_sight", "warlock.maddening_hex", "warlock.one_with_shadows",
                                   "warlock.lifedrinker", "warlock.shroud_of_shadow"] },
           { "choose": 1, "from": ["warlock.arms_of_hadar", "warlock.armor_of_agathys", "warlock.hellish_rebuke",
                                   "warlock.witch_bolt", "warlock.shatter", "warlock.misty_step", "warlock.hold_person",
                                   "warlock.darkness", "warlock.hunger_of_hadar", "warlock.counterspell",
                                   "warlock.vampiric_touch", "warlock.blight", "warlock.dimension_door",
                                   "warlock.shadow_of_moil", "warlock.synaptic_static", "warlock.hold_monster"] } ],
    "10": [ { "choose": 1, "from": ["warlock.arms_of_hadar", "warlock.armor_of_agathys", "warlock.hellish_rebuke",
                                    "warlock.witch_bolt", "warlock.shatter", "warlock.misty_step", "warlock.hold_person",
                                    "warlock.darkness", "warlock.hunger_of_hadar", "warlock.counterspell",
                                    "warlock.vampiric_touch", "warlock.blight", "warlock.dimension_door",
                                    "warlock.shadow_of_moil", "warlock.synaptic_static", "warlock.hold_monster"] } ]
  },
  "subclasses": [],
  "subclassesPending": true,
  "defaultPicks": {
    "1": ["warlock.chill_touch", "warlock.arms_of_hadar", "warlock.hellish_rebuke"],
    "2": ["warlock.chill_touch", "warlock.arms_of_hadar", "warlock.hellish_rebuke", "warlock.agonizing_blast",
          "warlock.repelling_blast"],
    "3": ["warlock.chill_touch", "warlock.arms_of_hadar", "warlock.hellish_rebuke", "warlock.agonizing_blast",
          "warlock.repelling_blast", "warlock.shatter"],
    "4": ["warlock.chill_touch", "warlock.arms_of_hadar", "warlock.hellish_rebuke", "warlock.agonizing_blast",
          "warlock.repelling_blast", "warlock.shatter", "warlock.hold_person"],
    "5": ["warlock.chill_touch", "warlock.arms_of_hadar", "warlock.hellish_rebuke", "warlock.agonizing_blast",
          "warlock.repelling_blast", "warlock.shatter", "warlock.hold_person", "warlock.maddening_hex",
          "warlock.hunger_of_hadar"],
    "6": ["warlock.chill_touch", "warlock.arms_of_hadar", "warlock.hellish_rebuke", "warlock.agonizing_blast",
          "warlock.repelling_blast", "warlock.shatter", "warlock.hold_person", "warlock.maddening_hex",
          "warlock.hunger_of_hadar", "warlock.counterspell"],
    "7": ["warlock.chill_touch", "warlock.arms_of_hadar", "warlock.hellish_rebuke", "warlock.agonizing_blast",
          "warlock.repelling_blast", "warlock.shatter", "warlock.hold_person", "warlock.maddening_hex",
          "warlock.hunger_of_hadar", "warlock.counterspell", "warlock.blight"],
    "8": ["warlock.chill_touch", "warlock.arms_of_hadar", "warlock.hellish_rebuke", "warlock.agonizing_blast",
          "warlock.repelling_blast", "warlock.shatter", "warlock.hold_person", "warlock.maddening_hex",
          "warlock.hunger_of_hadar", "warlock.counterspell", "warlock.blight", "warlock.shadow_of_moil"],
    "9": ["warlock.chill_touch", "warlock.arms_of_hadar", "warlock.hellish_rebuke", "warlock.agonizing_blast",
          "warlock.repelling_blast", "warlock.shatter", "warlock.hold_person", "warlock.maddening_hex",
          "warlock.hunger_of_hadar", "warlock.counterspell", "warlock.blight", "warlock.shadow_of_moil",
          "warlock.lifedrinker", "warlock.synaptic_static"],
    "10": ["warlock.chill_touch", "warlock.arms_of_hadar", "warlock.hellish_rebuke", "warlock.agonizing_blast",
           "warlock.repelling_blast", "warlock.shatter", "warlock.hold_person", "warlock.maddening_hex",
           "warlock.hunger_of_hadar", "warlock.counterspell", "warlock.blight", "warlock.shadow_of_moil",
           "warlock.lifedrinker", "warlock.synaptic_static", "warlock.hold_monster"]
  },
  "aiTags": { "tags": ["striker", "caster", "ranged"], "priority": ["cha", "con", "dex", "wis", "int", "str"] },
  "castingStat": "cha"
}
