{
  "id": "bard", "name": "Bard", "role": "healer", "hitDie": 8, "saves": ["dex", "cha"],
  "armorProf": ["light"], "weaponProf": ["simple", "hand_crossbow", "longsword", "rapier", "shortsword"],
  "skillChoices": { "count": 3, "from": ["performance", "persuasion", "deception", "acrobatics", "athletics", "history",
                                         "insight", "intimidation", "investigation", "nature", "perception", "religion",
                                         "sleight_of_hand", "stealth"] },
  "startingKit": { "weapon": "rapier", "armor": "leather", "shield": false,
                   "bag": [ { "item": "potion_of_healing", "count": 1 } ] },
  "resources": { "inspiration": { "1": 2, "3": 3, "5": 4, "7": 5, "10": 6 },
                 "mana": { "1": 4, "2": 5, "3": 7, "4": 8, "5": 8, "6": 9, "7": 10, "8": 10, "9": 11, "10": 12 } },
  "primaryResource": "mana",
  "features": {
    "1": [ { "ability": "bard.bardic_inspiration" },
           { "choose": 2, "from": ["bard.vicious_mockery", "bard.thunderclap", "bard.minor_illusion"] },
           { "choose": 3, "from": ["bard.healing_word", "bard.cure_wounds", "bard.dissonant_whispers", "bard.faerie_fire",
                                   "bard.heroism", "bard.thunderwave"] } ],
    "2": [ { "ability": "bard.song_of_rest" }, { "passive": "bard.jack_of_all_trades" },
           { "choose": 1, "from": ["bard.healing_word", "bard.cure_wounds", "bard.dissonant_whispers", "bard.faerie_fire",
                                   "bard.heroism", "bard.thunderwave"] } ],
    "3": [ { "choose": 2, "from": ["bard.healing_word", "bard.cure_wounds", "bard.dissonant_whispers", "bard.faerie_fire",
                                   "bard.heroism", "bard.thunderwave", "bard.shatter", "bard.hold_person",
                                   "bard.lesser_restoration", "bard.silence"] } ],
    "4": [ { "choose": 1, "from": ["bard.healing_word", "bard.cure_wounds", "bard.dissonant_whispers", "bard.faerie_fire",
                                   "bard.heroism", "bard.thunderwave", "bard.shatter", "bard.hold_person",
                                   "bard.lesser_restoration", "bard.silence"] } ],
    "5": [ { "passive": "bard.font_of_inspiration" },
           { "choose": 2, "from": ["bard.healing_word", "bard.cure_wounds", "bard.dissonant_whispers", "bard.faerie_fire",
                                   "bard.heroism", "bard.thunderwave", "bard.shatter", "bard.hold_person",
                                   "bard.lesser_restoration", "bard.silence", "bard.hypnotic_pattern",
                                   "bard.mass_healing_word", "bard.dispel_magic"] } ],
    "6": [ { "ability": "bard.countercharm" },
           { "choose": 1, "from": ["bard.healing_word", "bard.cure_wounds", "bard.dissonant_whispers", "bard.faerie_fire",
                                   "bard.heroism", "bard.thunderwave", "bard.shatter", "bard.hold_person",
                                   "bard.lesser_restoration", "bard.silence", "bard.hypnotic_pattern",
                                   "bard.mass_healing_word", "bard.dispel_magic"] } ],
    "7": [ { "choose": 1, "from": ["bard.healing_word", "bard.cure_wounds", "bard.dissonant_whispers", "bard.faerie_fire",
                                   "bard.heroism", "bard.thunderwave", "bard.shatter", "bard.hold_person",
                                   "bard.lesser_restoration", "bard.silence", "bard.hypnotic_pattern",
                                   "bard.mass_healing_word", "bard.dispel_magic", "bard.greater_invisibility",
                                   "bard.dimension_door"] } ],
    "8": [ { "choose": 1, "from": ["bard.healing_word", "bard.cure_wounds", "bard.dissonant_whispers", "bard.faerie_fire",
                                   "bard.heroism", "bard.thunderwave", "bard.shatter", "bard.hold_person",
                                   "bard.lesser_restoration", "bard.silence", "bard.hypnotic_pattern",
                                   "bard.mass_healing_word", "bard.dispel_magic", "bard.greater_invisibility",
                                   "bard.dimension_door"] } ],
    "9": [ { "choose": 1, "from": ["bard.healing_word", "bard.cure_wounds", "bard.dissonant_whispers", "bard.faerie_fire",
                                   "bard.heroism", "bard.thunderwave", "bard.shatter", "bard.hold_person",
                                   "bard.lesser_restoration", "bard.silence", "bard.hypnotic_pattern",
                                   "bard.mass_healing_word", "bard.dispel_magic", "bard.greater_invisibility",
                                   "bard.dimension_door", "bard.hold_monster", "bard.greater_restoration"] } ],
    "10": [ { "choose": 1, "from": ["bard.healing_word", "bard.cure_wounds", "bard.dissonant_whispers", "bard.faerie_fire",
                                    "bard.heroism", "bard.thunderwave", "bard.shatter", "bard.hold_person",
                                    "bard.lesser_restoration", "bard.silence", "bard.hypnotic_pattern",
                                    "bard.mass_healing_word", "bard.dispel_magic", "bard.greater_invisibility",
                                    "bard.dimension_door", "bard.hold_monster", "bard.greater_restoration"] } ]
  },
  "subclasses": [
    { "id": "bard.valor", "name": "College of Valor",
      "features": {
        "3": [ { "ability": "valor.combat_inspiration" }, { "passive": "valor.battle_readiness" } ],
        "6": [ { "attacks": 2 } ],
        "10": [ { "ability": "valor.battle_magic" } ]
      } },
    { "id": "bard.lore", "name": "College of Lore",
      "features": {
        "3": [ { "ability": "lore.cutting_words" }, { "passive": "lore.arcane_scholar" } ],
        "6": [ { "ability": "lore.counterspell" }, { "ability": "lore.magical_secrets" } ],
        "10": [ { "ability": "lore.peerless_skill" } ]
      } },
    { "id": "bard.siren", "name": "College of the Siren",
      "features": {
        "3": [ { "ability": "siren.alluring_verse" } ],
        "6": [ { "ability": "siren.enthralling_aria" } ],
        "10": [ { "ability": "siren.sirens_call" } ]
      } }
  ],
  "defaultPicks": {
    "1": ["bard.vicious_mockery", "bard.thunderclap", "bard.healing_word", "bard.cure_wounds", "bard.dissonant_whispers"],
    "2": ["bard.vicious_mockery", "bard.thunderclap", "bard.healing_word", "bard.cure_wounds", "bard.dissonant_whispers",
          "bard.faerie_fire"],
    "3": ["bard.vicious_mockery", "bard.thunderclap", "bard.healing_word", "bard.cure_wounds", "bard.dissonant_whispers",
          "bard.faerie_fire", "bard.shatter", "bard.hold_person"],
    "4": ["bard.vicious_mockery", "bard.thunderclap", "bard.healing_word", "bard.cure_wounds", "bard.dissonant_whispers",
          "bard.faerie_fire", "bard.shatter", "bard.hold_person", "bard.heroism"],
    "5": ["bard.vicious_mockery", "bard.thunderclap", "bard.healing_word", "bard.cure_wounds", "bard.dissonant_whispers",
          "bard.faerie_fire", "bard.shatter", "bard.hold_person", "bard.heroism", "bard.hypnotic_pattern",
          "bard.mass_healing_word"],
    "6": ["bard.vicious_mockery", "bard.thunderclap", "bard.healing_word", "bard.cure_wounds", "bard.dissonant_whispers",
          "bard.faerie_fire", "bard.shatter", "bard.hold_person", "bard.heroism", "bard.hypnotic_pattern",
          "bard.mass_healing_word", "bard.dispel_magic"],
    "7": ["bard.vicious_mockery", "bard.thunderclap", "bard.healing_word", "bard.cure_wounds", "bard.dissonant_whispers",
          "bard.faerie_fire", "bard.shatter", "bard.hold_person", "bard.heroism", "bard.hypnotic_pattern",
          "bard.mass_healing_word", "bard.dispel_magic", "bard.greater_invisibility"],
    "8": ["bard.vicious_mockery", "bard.thunderclap", "bard.healing_word", "bard.cure_wounds", "bard.dissonant_whispers",
          "bard.faerie_fire", "bard.shatter", "bard.hold_person", "bard.heroism", "bard.hypnotic_pattern",
          "bard.mass_healing_word", "bard.dispel_magic", "bard.greater_invisibility", "bard.lesser_restoration"],
    "9": ["bard.vicious_mockery", "bard.thunderclap", "bard.healing_word", "bard.cure_wounds", "bard.dissonant_whispers",
          "bard.faerie_fire", "bard.shatter", "bard.hold_person", "bard.heroism", "bard.hypnotic_pattern",
          "bard.mass_healing_word", "bard.dispel_magic", "bard.greater_invisibility", "bard.lesser_restoration",
          "bard.hold_monster"],
    "10": ["bard.vicious_mockery", "bard.thunderclap", "bard.healing_word", "bard.cure_wounds", "bard.dissonant_whispers",
           "bard.faerie_fire", "bard.shatter", "bard.hold_person", "bard.heroism", "bard.hypnotic_pattern",
           "bard.mass_healing_word", "bard.dispel_magic", "bard.greater_invisibility", "bard.lesser_restoration",
           "bard.hold_monster", "bard.greater_restoration"]
  },
  "aiTags": { "tags": ["healer", "support", "caster"], "priority": ["cha", "dex", "con", "wis", "int", "str"] },
  "castingStat": "cha"
}
