{
  "id": "paladin", "name": "Paladin", "role": "defender", "hitDie": 10, "saves": ["wis", "cha"],
  "armorProf": ["light", "medium", "heavy", "shield"], "weaponProf": ["simple", "martial"],
  "skillChoices": { "count": 2, "from": ["athletics", "religion", "insight", "intimidation", "medicine", "persuasion"] },
  "startingKit": { "weapon": "longsword", "armor": "chain_mail", "shield": true,
                   "bag": [ { "item": "potion_of_healing", "count": 1 } ] },
  "resources": { "oath": { "1": 2, "3": 3, "4": 4, "6": 5, "7": 6, "9": 7, "10": 8 },
                 "lay_on_hands": { "1": 1, "2": 2, "3": 3, "4": 4, "5": 5, "6": 6, "7": 7, "8": 8, "9": 9, "10": 10 } },
  "primaryResource": "oath",
  "features": {
    "1": [ { "ability": "paladin.lay_on_hands" },
           { "choose": 2, "from": ["paladin.bless", "paladin.command", "paladin.compelled_duel", "paladin.cure_wounds", "paladin.shield_of_faith"] } ],
    "2": [ { "choose": 1, "from": ["fighter.style_defense", "fighter.style_dueling", "fighter.style_great_weapon"] },
           { "ability": "paladin.divine_smite" }, { "passive": "paladin.smite_damage" } ],
    "3": [ { "choose": 1, "from": ["paladin.bless", "paladin.command", "paladin.compelled_duel", "paladin.cure_wounds", "paladin.shield_of_faith"] } ],
    "4": [ { "choose": 1, "from": ["paladin.bless", "paladin.command", "paladin.compelled_duel", "paladin.cure_wounds", "paladin.shield_of_faith"] } ],
    "5": [ { "attacks": 2 },
           { "ability": "paladin.divine_smite_2" }, { "passive": "paladin.smite_damage_2" },
           { "choose": 1, "from": ["paladin.bless", "paladin.command", "paladin.compelled_duel", "paladin.cure_wounds", "paladin.shield_of_faith",
                                   "paladin.aid", "paladin.lesser_restoration"] } ],
    "6": [ { "passive": "paladin.aura_of_protection_start" }, { "passive": "paladin.aura_of_protection" } ],
    "7": [ { "choose": 1, "from": ["paladin.bless", "paladin.command", "paladin.compelled_duel", "paladin.cure_wounds", "paladin.shield_of_faith",
                                   "paladin.aid", "paladin.lesser_restoration"] } ],
    "8": [ { "choose": 1, "from": ["paladin.bless", "paladin.command", "paladin.compelled_duel", "paladin.cure_wounds", "paladin.shield_of_faith",
                                   "paladin.aid", "paladin.lesser_restoration"] } ],
    "9": [ { "ability": "paladin.divine_smite_3" }, { "passive": "paladin.smite_damage_3" },
           { "choose": 1, "from": ["paladin.bless", "paladin.command", "paladin.compelled_duel", "paladin.cure_wounds", "paladin.shield_of_faith",
                                   "paladin.aid", "paladin.lesser_restoration", "paladin.dispel_magic", "paladin.elemental_weapon"] } ],
    "10": [ { "choose": 1, "from": ["paladin.bless", "paladin.command", "paladin.compelled_duel", "paladin.cure_wounds", "paladin.shield_of_faith",
                                    "paladin.aid", "paladin.lesser_restoration", "paladin.dispel_magic", "paladin.elemental_weapon"] } ]
  },
  "subclasses": [
    { "id": "paladin.guardian", "name": "Guardian",
      "features": {
        "3": [ { "ability": "guardian.sanctuary_aegis" }, { "ability": "guardian.righteous_challenge" } ],
        "6": [ { "ability": "guardian.divine_intervention" }, { "passive": "guardian.steadfast" } ],
        "10": [ { "ability": "guardian.aegis_of_faith" } ]
      } },
    { "id": "paladin.crusader", "name": "Crusader",
      "features": {
        "3": [ { "ability": "crusader.searing_smite" }, { "passive": "crusader.radiant_blades" } ],
        "6": [ { "ability": "crusader.consecrated_ground" } ],
        "10": [ { "ability": "crusader.dawnbreaker" } ]
      } },
    { "id": "paladin.avenger", "name": "Avenger",
      "features": {
        "3": [ { "ability": "avenger.vow_of_enmity" }, { "ability": "avenger.abjure_enemy" } ],
        "6": [ { "ability": "avenger.relentless_step" }, { "passive": "avenger.vengeful_strikes" } ],
        "10": [ { "ability": "avenger.soul_of_vengeance" } ]
      } }
  ],
  "defaultPicks": {
    "1": ["paladin.bless", "paladin.cure_wounds"],
    "2": ["paladin.bless", "paladin.cure_wounds", "fighter.style_defense"],
    "3": ["paladin.bless", "paladin.cure_wounds", "fighter.style_defense", "paladin.shield_of_faith"],
    "4": ["paladin.bless", "paladin.cure_wounds", "fighter.style_defense", "paladin.shield_of_faith", "paladin.compelled_duel"],
    "5": ["paladin.bless", "paladin.cure_wounds", "fighter.style_defense", "paladin.shield_of_faith", "paladin.compelled_duel",
          "paladin.aid"],
    "6": ["paladin.bless", "paladin.cure_wounds", "fighter.style_defense", "paladin.shield_of_faith", "paladin.compelled_duel",
          "paladin.aid"],
    "7": ["paladin.bless", "paladin.cure_wounds", "fighter.style_defense", "paladin.shield_of_faith", "paladin.compelled_duel",
          "paladin.aid", "paladin.command"],
    "8": ["paladin.bless", "paladin.cure_wounds", "fighter.style_defense", "paladin.shield_of_faith", "paladin.compelled_duel",
          "paladin.aid", "paladin.command", "paladin.lesser_restoration"],
    "9": ["paladin.bless", "paladin.cure_wounds", "fighter.style_defense", "paladin.shield_of_faith", "paladin.compelled_duel",
          "paladin.aid", "paladin.command", "paladin.lesser_restoration", "paladin.elemental_weapon"],
    "10": ["paladin.bless", "paladin.cure_wounds", "fighter.style_defense", "paladin.shield_of_faith", "paladin.compelled_duel",
           "paladin.aid", "paladin.command", "paladin.lesser_restoration", "paladin.elemental_weapon", "paladin.dispel_magic"]
  },
  "aiTags": { "tags": ["defender", "melee", "front"], "priority": ["str", "cha", "con", "wis", "dex", "int"] },
  "castingStat": "cha"
}
